experiments/data/memory/memory_benchmarks.csv
workload,variant,execution_time_ms,peak_memory_bytes,operation_count,memory_traffic_bytes,num_stages,num_states,size
matrix,baseline,25.815000000875443,37208,10240,251658240,,,32
matrix,baseline,26.63990001019556,37116,10240,251658240,,,32
matrix,baseline,25.613600009819493,37116,10240,251658240,,,32
matrix,baseline,26.284199993824586,37116,10240,251658240,,,32
matrix,baseline,25.87640000274405,37184,10240,251658240,,,32
matrix,baseline,25.726700012455694,37220,10240,251658240,,,32
matrix,baseline,25.698099998407997,37164,10240,251658240,,,32
matrix,baseline,25.741799996467307,37164,10240,251658240,,,32
matrix,baseline,32.08669999730773,37196,10240,251658240,,,32
matrix,baseline,30.47569999762345,37152,10240,251658240,,,32
matrix,atomik,20.597599999746308,37400,5120,32768,,,32
matrix,atomik,20.348000005469657,37404,5120,32768,,,32
matrix,atomik,20.850900007644668,37396,5120,32768,,,32
matrix,atomik,22.807799992733635,37408,5120,32768,,,32
matrix,atomik,21.017099992604926,37404,5120,32768,,,32
matrix,atomik,22.13060000212863,37392,5120,32768,,,32
matrix,atomik,21.814400010043755,37404,5120,32768,,,32
matrix,atomik,20.32520000648219,37404,5120,32768,,,32
matrix,atomik,20.65430000948254,37404,5120,32768,,,32
matrix,atomik,20.075899999937974,37392,5120,32768,,,32
matrix,baseline,117.51039999944624,146992,40960,4026531840,,,64
matrix,baseline,124.95769999804907,146984,40960,4026531840,,,64
matrix,baseline,108.8097000028938,147060,40960,4026531840,,,64
matrix,baseline,104.17410000809468,147020,40960,4026531840,,,64
matrix,baseline,104.3140000110725,147016,40960,4026531840,,,64
matrix,baseline,104.20040000462905,146968,40960,4026531840,,,64
matrix,baseline,104.15020000073127,147016,40960,4026531840,,,64
matrix,baseline,105.64029999659397,146972,40960,4026531840,,,64
matrix,baseline,105.06020000320859,147024,40960,4026531840,,,64
matrix,baseline,106.50109998823609,147012,40960,4026531840,,,64
matrix,atomik,83.40540000062902,147916,20480,131072,,,64
matrix,atomik,82.51279999967664,147936,20480,131072,,,64
matrix,atomik,82.86450000014156,147972,20480,131072,,,64
matrix,atomik,83.29399999638554,147944,20480,131072,,,64
matrix,atomik,83.38480000384152,147932,20480,131072,,,64
matrix,atomik,80.47200000146404,147912,20480,131072,,,64
matrix,atomik,81.74500000313856,147976,20480,131072,,,64
matrix,atomik,83.39379999961238,147940,20480,131072,,,64
matrix,atomik,82.29089999804273,147980,20480,131072,,,64
matrix,atomik,81.7834000044968,147964,20480,131072,,,64
state_machine,baseline,0.2395999908912927,4736,1000,4024000,,100,
state_machine,baseline,0.22200000239536166,4792,1000,4024000,,100,
state_machine,baseline,0.19419999443925917,4728,1000,4024000,,100,
state_machine,baseline,0.1897000038297847,4728,1000,4024000,,100,
state_machine,baseline,0.1959000073838979,4728,1000,4024000,,100,
state_machine,baseline,0.19099999917671084,4728,1000,4024000,,100,
state_machine,baseline,0.18999999156221747,4728,1000,4024000,,100,
state_machine,baseline,0.18930000078398734,4728,1000,4024000,,100,
state_machine,baseline,0.19130000146105886,4728,1000,4024000,,100,
state_machine,baseline,0.1990000018849969,4728,1000,4024000,,100,
state_machine,atomik,0.17989998741541058,4608,1000,4032,,100,
state_machine,atomik,0.23859999782871455,4792,1000,4032,,100,
state_machine,atomik,0.2133999951183796,4728,1000,4032,,100,
state_machine,atomik,0.21600000036414713,4728,1000,4032,,100,
state_machine,atomik,0.2046999870799482,4728,1000,4032,,100,
state_machine,atomik,0.20509999012574553,4728,1000,4032,,100,
state_machine,atomik,0.20419999782461673,4728,1000,4032,,100,
state_machine,atomik,0.20540000696200877,4728,1000,4032,,100,
state_machine,atomik,0.21330000890884548,4728,1000,4032,,100,
state_machine,atomik,0.2049000031547621,4728,1000,4032,,100,
state_machine,baseline,0.23550000332761556,4736,1000,4024000,,500,
state_machine,baseline,0.16310000501107424,4632,1000,4024000,,500,
state_machine,baseline,0.17010000010486692,4632,1000,4024000,,500,
state_machine,baseline,0.16480000340379775,4632,1000,4024000,,500,
state_machine,baseline,0.16379999578930438,4632,1000,4024000,,500,
state_machine,baseline,0.16599999798927456,4632,1000,4024000,,500,
state_machine,baseline,0.16540000797249377,4632,1000,4024000,,500,
state_machine,baseline,0.16920000780373812,4632,1000,4024000,,500,
state_machine,baseline,0.1604999997653067,4632,1000,4024000,,500,
state_machine,baseline,0.16339999274350703,4632,1000,4024000,,500,
state_machine,atomik,0.3417000116314739,4832,1000,4032,,500,
state_machine,atomik,0.20629999926313758,4632,1000,4032,,500,
state_machine,atomik,0.20129999029450119,4632,1000,4032,,500,
state_machine,atomik,0.20290000247769058,4632,1000,4032,,500,
state_machine,atomik,0.20539999241009355,4632,1000,4032,,500,
state_machine,atomik,0.20580001000780612,4632,1000,4032,,500,
state_machine,atomik,0.1984000118682161,4632,1000,4032,,500,
state_machine,atomik,0.19940000493079424,4632,1000,4032,,500,
state_machine,atomik,0.20169999334029853,4632,1000,4032,,500,
state_machine,atomik,0.20099998801015317,4632,1000,4032,,500,
streaming,baseline,5.84559999697376,772,5000,600000,5,,
streaming,baseline,5.596499991952442,796,5000,600000,5,,
streaming,baseline,6.2618000083602965,796,5000,600000,5,,
streaming,baseline,5.655499990098178,772,5000,600000,5,,
streaming,baseline,5.615200003376231,796,5000,600000,5,,
streaming,baseline,5.6284000020241365,796,5000,600000,5,,
streaming,baseline,6.880999993882142,796,5000,600000,5,,
streaming,baseline,5.582300000241958,796,5000,600000,5,,
streaming,baseline,5.649499988066964,796,5000,600000,5,,
streaming,baseline,5.56779999169521,796,5000,600000,5,,
streaming,atomik,3.0707000114489347,732,2500,160,5,,
streaming,atomik,3.077600005781278,756,2500,160,5,,
streaming,atomik,3.0995000124676153,756,2500,160,5,,
streaming,atomik,3.1079999898793176,756,2500,160,5,,
streaming,atomik,3.154499994707294,756,2500,160,5,,
streaming,atomik,3.143699999782257,756,2500,160,5,,
streaming,atomik,3.078900001128204,756,2500,160,5,,
streaming,atomik,3.0981999880168587,756,2500,160,5,,
streaming,atomik,3.613599998061545,756,2500,160,5,,
streaming,atomik,3.1137000041780993,756,2500,160,5,,
streaming,baseline,17.200400005094707,1232,20000,9600000,20,,
streaming,baseline,17.148099999758415,1336,20000,9600000,20,,
streaming,baseline,17.31570000993088,1400,20000,9600000,20,,
streaming,baseline,17.25980000628624,1400,20000,9600000,20,,
streaming,baseline,17.29449999402277,1400,20000,9600000,20,,
streaming,baseline,17.316800003754906,1396,20000,9600000,20,,
streaming,baseline,17.42210000520572,1400,20000,9600000,20,,
streaming,baseline,17.566300011822022,1400,20000,9600000,20,,
streaming,baseline,17.37699999648612,1400,20000,9600000,20,,
streaming,baseline,17.405299993697554,1400,20000,9600000,20,,
streaming,atomik,7.109900005161762,1272,10000,640,20,,
streaming,atomik,7.1629000012762845,1296,10000,640,20,,
streaming,atomik,7.136399988667108,1296,10000,640,20,,
streaming,atomik,7.18649999180343,1296,10000,640,20,,
streaming,atomik,7.129100005840883,1296,10000,640,20,,
streaming,atomik,7.206499998574145,1296,10000,640,20,,
streaming,atomik,7.152400008635595,1296,10000,640,20,,
streaming,atomik,7.169599994085729,1296,10000,640,20,,
streaming,atomik,7.2395000024698675,1360,10000,640,20,,
streaming,atomik,7.344400000874884,1360,10000,640,20,,
